{
  "admission_type": "knowledge_asset",
  "artifacts": [
    {
      "copy_metadata": {
        "content_role": "reviewed_knowledge_asset",
        "example_only": true
      },
      "destination_kb_path": "cosmetics/example-source-family/knowledge/component-example/component.md",
      "expected_sha256": "3333333333333333333333333333333333333333333333333333333333333333",
      "input_workspace_path": "operations/admission/examples/stage2/knowledge_component.v1/payload/component.md"
    }
  ],
  "copy_operation": {
    "content_mode": "byte_for_byte",
    "operation_type": "copy",
    "overwrite_policy": "fail_closed_on_hash_mismatch",
    "requested_by": "admission-stage2-example"
  },
  "lineage": {
    "admission_package_ref": "operations/admission/examples/stage2/knowledge_component.v1/stage1/admission_package.json",
    "asset_id": "component-example",
    "knowledge_profile_id": "component_extraction.v1"
  }
}
