{
  "admission_type": "knowledge_asset",
  "artifacts": [
    {
      "copy_metadata": {
        "content_role": "reviewed_knowledge_asset",
        "example_only": true
      },
      "destination_kb_path": "cosmetics/example-source-family/knowledge/recipe-formula-example/recipe-formula.md",
      "expected_sha256": "2222222222222222222222222222222222222222222222222222222222222222",
      "input_workspace_path": "cosmetics/example-source-family/workflow/admission-stage2-example/recipe-formula-example/payload/recipe-formula.md"
    }
  ],
  "copy_operation": {
    "content_mode": "byte_for_byte",
    "operation_type": "copy",
    "overwrite_policy": "fail_closed_on_hash_mismatch",
    "requested_by": "admission-stage2-example"
  },
  "lineage": {
    "admission_package_ref": "operations/admission/examples/stage2/knowledge_recipe_formula.v1/stage1/admission_package.json",
    "asset_id": "recipe-formula-example",
    "knowledge_profile_id": "recipe_formula_extraction.v1"
  }
}
